"","GO","female_gonad_control_bldg","female_hypothalamus_control_bldg","female_pituitary_control_bldg","male_gonad_control_bldg","male_hypothalamus_control_bldg","male_pituitary_control_bldg","female_gonad_bldg_lay","female_pituitary_bldg_lay","male_gonad_bldg_lay","female_gonad_lay_inc.d3","female_pituitary_lay_inc.d3","male_gonad_lay_inc.d3","female_gonad_inc.d3_inc.d9","female_gonad_inc.d9_inc.d17","female_pituitary_inc.d9_inc.d17","male_hypothalamus_inc.d9_inc.d17","male_pituitary_inc.d9_inc.d17","male_pituitary_inc.d17_hatch","female_hypothalamus_hatch_n5","female_pituitary_hatch_n5","male_pituitary_hatch_n5","male_pituitary_n5_n9","female_gonad_n5_n9"
"1","candidategenes","AR, AVPR1A, BRCA1, CDK1, CEBPD, CYP19A1, DIO1, DIO2, EGR1, ESR1, ESR2, FSHB, GRIA1, JAK2, KCNJ5, LBH, MC5R, NR3C1, POMC, PTEN, PTGER3, SOX9","AGRP, AR, CREBBP, CYP19A1, DRD1, ESR1, FSHB, GNRHR, HCRT, JAK2, JUN, NR3C1, NR3C2, POMC, PRL, PRLR, PTEN, VIP, ZBTB16","AR, AVP, AVPR2, BDNF, CREBBP, CYP19A1, DIO3, DRD1, FOS, GRIA1, JAK2, KCNJ5, LBH, NPVF, NPY, NR3C1, OXT, PRL, PRLR, PTEN, PTGER3, STAT5B, TRH, TSHB, VIPR1, VIPR2","AR, BRCA1, ESR1, GRIA1, GRM2, JAK2, NR3C1, POMC, PRL, PRLR, PTEN, PTGER3, SOX9, STAT5B, VIPR1, ZBTB16","AGRP, AR, AVPR2, BRCA1, CDK1, CRH, CYP19A1, DIO2, EGR1, ESR1, FSHB, GNRH1, GNRHR, MC4R, MC5R, NPVF, NPY, NR3C1, POMC, PRL, STAT5B, TRH, VIP, VIPR1","AR, AVP, AVPR1B, AVPR2, BDNF, CREBBP, CYP19A1, DIO3, FSHB, KCNJ5, NPY, NR3C1, NR3C2, OXT, POMC, PRL, PRLR, PTEN, STAT5B, TSHB, VIPR1","TRH","DIO3, ESR1, GNRHR",NA,"AGRP, AVPR1A, DIO2, EGR1, FOS, NR3C1, PRLR, PTGER3, VIPR1","ESR1, GNRHR, PTEN, ZBTB16","SOX9","AVPR1A","SOX9","BRCA1, CDK1, DIO2, KCNJ5, LBH, MC5R, PRL, STAT5B, TSHB","AR","BRCA1, CDK1, CISH, GRM2, LBH, PRL, VIP","GRM2","BDNF, BRCA1, CISH, CYP19A1, DRD1, EGR1, GRIA1, HCRT, MC4R, NPVF, POMC","AVPR2, BRCA1, CDK1, GRIA1, LBH, PRL, TSHB","CEBPD, ZBTB16","BRCA1, CDK1, CEBPD",NA
"2","endocrineprocess","ACE, AVPR1A, CRHBP, CRHR1, CRHR2, CRY1, CRY2, DAB2, EDN1, EDN3, ENPEP, F2R, F2RL1, FAM129B, FGFR1, FZD4, GAL, GJA1, NOS3, OPRK1, POMC, RAB11FIP1, RAB8B, RASL10B, SERPINF2, SMAD4, TAC1, TBX3","ACE2, ACVR2A, ATP6AP2, BMP6, CGA, CRHBP, DAB2, ECE1, EDN3, FOXD1, GAL, GHRL, GJA1, GNAS, INHBA, OPRK1, POMC, PTPN11, RAB11FIP1, RHOA, RUNX1, SMAD4, TAC1, TBX3, TMF1","ACE2, ACVR2A, AVPR2, CGA, CORIN, CRY1, ECE1, FGFR1, FOXL2, FZD4, GHRL, INHBA, INHBB, KRAS, NPVF, PEX5L, PTPN11, RAB11FIP1, RAB11FIP5, RHOA, SERPINF2, SMAD4, TACR1","AGT, CGA, CRHR2, CRY1, ENPEP, F2RL1, GALR1, GDF9, INHBB, MIF, POMC, PTPN11, RAB11FIP1, RAB11FIP5, SMAD4, TBX3","ACE2, ACVR2A, AVPR2, CGA, CRH, CRY1, DAB2, FGFR1, GAL, GALR1, GJA1, NPVF, POMC, RAB11FIP1, RAB11FIP5, RAB8B, RASL10B, RHOA, SMAD4, TACR1, TBX3, TMF1","ACVR2A, AVPR1B, AVPR2, CORIN, CRY1, DAB2, ECE1, F2R, FGFR1, FOXL2, FZD4, GHRL, PEX5L, POMC, PTPN11, RAB11FIP1, RAB11FIP5, RASL10B, RHOA, SERPINF2, SMAD4, TMF1",NA,"AGT, BMP6, CGA, GAL",NA,"AVPR1A, C1QTNF1, CRY2, F2R, GJA1, RHOA","CGA, RAB11FIP5","ACE2","AVPR1A","BMP6, DRD5","ATP6AP2, CRY1, SMAD4, TMF1",NA,NA,NA,"CRHBP, CRHR2, DRD3, EDN3, FAM129B, FOXL2, KRAS, NPVF, OPRK1, POMC, RAB11FIP5, RAB8B, RUNX1, TAC1","ATP6AP2, AVPR2, CRY2, FOXL2, RHOA",NA,NA,NA
"3","lactation","CCND1, CREB1, ERBB4, GJA1, MED1, NME1, XBP1, XDH, ZBTB7B","ATP2B2, ATP7B, CDO1, GHRHR, GJA1, HIF1A, KALRN, MED1, NME1, PRL, PRLR, SOCS2, XBP1","CCND1, CREB1, PRL, PRLR, SOCS2, STAT5B, XBP1, ZBTB7B","APRT, CCND1, CREB1, EIF2AK3, GHRHR, MED1, PRL, PRLR, SOCS2, STAT5B, XDH","APRT, ATP2B2, ATP7B, CDO1, CREB1, ERBB4, GHRHR, GJA1, HIF1A, MED1, NME1, PRL, STAT5B","APRT, ATP7B, CCND1, CREB1, HIF1A, NME1, PRL, PRLR, SOCS2, STAT5B, XBP1, ZBTB7B","NME1","XBP1","EIF2AK3","ATP2B2, CAV1, GJA1, HIF1A, MED1, PRLR, XBP1, ZBTB7B","XBP1","HIF1A",NA,NA,"EIF2AK3, PRL, SOCS2, STAT5B, XBP1",NA,"PRL",NA,"CAV1, ZBTB7B","EIF2AK3, PRL, XBP1","CDO1",NA,"ZBTB7B"
"4","matingbehavior","APP, AR, AVPR1A, CYP11A1, GRIN1, HDAC2, HDAC4, NCOA1, PGR, PPP1R1B, PTEN, SERPINE2, TGM4","APLP2, APP, AR, DRD1, GRIN1, HDAC4, NCOA2, PPP1R1B, PTEN, SERPINE2, TH, THRB, UBE2Q1","APLP2, APP, AR, AVP, DRD1, GRIN1, HDAC2, HDAC4, HEXB, NCOA1, OXT, PTEN, SERPINE2, TH, UBE2Q1","APLP2, AR, HDAC4, HEXB, PTEN","APLP2, APP, AR, GRIN1, HDAC4, NCOA1, NCOA2, SERPINE2","APLP2, APP, AR, AVP, HDAC4, HEXB, NCOA1, OXT, PTEN, TH","APLP2, CYP11A1","TH",NA,"AVPR1A, NCOA2","PTEN",NA,"AVPR1A","DRD5","APP, HDAC4, NCOA1","AR",NA,NA,"APLP2, DRD1, PGR, THRB","APP, NCOA1",NA,NA,NA
"5","parentalbehavior","AVPR1A, BRINP1, DBH, GNAQ, NPAS3, NR3C1, OPRK1, PTEN","BRINP1, DRD1, GNAQ, KALRN, NPAS3, NR3C1, OPRK1, PRL, PTEN","AVP, DRD1, GNAQ, MBD2, NR3C1, OXT, PRL, PTEN, ZFX","CREBRF, GNAQ, NPAS3, NR3C1, PRL, PTEN, ZFX","GNAQ, NR3C1, PRL","AVP, BRINP1, GNAQ, NPAS3, NR3C1, OXT, PRL, PTEN, ZFX","CREBRF",NA,NA,"AVPR1A, CREBRF, GNAQ, NR3C1","PTEN",NA,"AVPR1A",NA,"PRL",NA,"PRL",NA,"DRD1, GNAQ, OPRK1","PRL",NA,NA,NA
