"","GO","pituitary.control.bldg","pituitary.bldg.lay","pituitary.lay.inc.d3","pituitary.inc.d9.inc.d17","pituitary.hatch.n5"
"1","candidategenes","AR, AVP, GH, GNRH1, JAK2, NPY, OXT, PRLR, STAT5B, TRH, TSHB","ESR1","ESR1","STAT5B, TSHB","TSHB"
"2","endocrineprocess","ACE2, ACVR2A, AVPR2, CGA, CORIN, CRY1, ECE1, FGFR1, FOXL2, FZD4, GHRL, INHBA, INHBB, KRAS, NPVF, PEX5L, PTPN11, RAB11FIP1, RAB11FIP5, RASL10B, RHOA, SERPINF2, SMAD4, TACR1","BMP6, CGA, GAL","CGA, GAL","ATP6AP2, CRY1, TMF1","ATP6AP2, AVPR2, CRY2, RHOA"
"3","lactation","CCND1, CREB1, PRL, PRLR, SOCS2, STAT5B, XBP1, ZBTB7B","XBP1","XBP1","EIF2AK3, PRL, SOCS2, STAT5B, XBP1","EIF2AK3, NME1, PRL, XBP1"
"4","matingbehavior","APLP2, APP, AR, AVP, DRD1, GRIN1, GRIN1, HDAC2, HDAC4, HEXB, NCOA1, OXT, PTEN, SERPINE2, TH, UBE2Q1","TH","PTEN","APP, HDAC4, NCOA1","APP, NCOA1"
"5","parentalbehavior","AVP, DRD1, GNAQ, MBD2, NR3C1, OXT, PRL, PTEN, ZFX",NA,"PTEN","PRL","PRL"
