"net$colors","genes"
"blue","A2ML2, A4GNT, ABCA13, ABHD6, ABI1, ABLIM3, AC025263.3, ACBD6, ACE, ACSL3, ACTN1, ADCY1, ADPRHL1, ADRA1B, AFF2, AGBL1, AGFG1, AGMO, AGTR2, AGXT2L2, AHRR, AIFM3, AIM1, AK6, AKAP7L, AKAP8L, ALG13, ALG8, ALKBH8, AMER3, AMIGO2, ANGPTL7, ANKDD1A, ANKRD28, ANKRD29, ANKRD33B, ANXA10, APOH, ARHGAP22, ARHGEF38, ARPP21, ARSH, ASIP, ATCAY, ATP10B, ATP5F1, ATP5S, ATP8A1, ATRN, AURKA, AvBD9, BAI1, BAI3, BANK1, BARHL2, BCO2, BEND4, BEST3, BFSP1, BFSP2, BHLHE23, BLNK, BMP2, BMP5, BOLL, BRAF, BRDT, BRINP1, BTBD10, BTBD6, C10H15ORF61, C10ORF10, C10ORF122, C11ORF24, C11ORF30, C12H3ORF67, C14ORF180, C14ORF39, C17H9ORF96, C1H12ORF40, C1H2ORF40, C1ORF100, C1ORF94, C26H6ORF132, C2H8orf34, C4H4ORF45, C4ORF48, C5H14ORF37, C5ORF49, C6ORF58, C8ORF34, C8ORF88, C9ORF24, CACNA1H, CACNA2D1, CACNA2D4, CACNG2, CACNG5, CALII, CAMK4, CAMKV, CAPN6, CAV3, CBFA2T2, CBLL1, CCDC174, CCDC34, CCDC63, CCDC73, CCDC85A, CCDC97, CCK, CCL17, CCNB3, CCND3, CCNG1, CCNK, CD163, CD55, CD86, CDH15, CDH8, CDKL5, CDKN3, CDX4, CENPW, CFL2, CG-16, CGNRH-R, CHAT, CHCHD5, CHCHD7, CHD2, CHD7, CHGB, CHRM4, CHRNA1, CHRNA4, CHRNA9, CHTF8, CIB3, CIDEA, CLEC18A, CLSTN3, CLVS1, CMTR2, CNDP2, CNNM4, CNOT11, CNOT4, CNTNAP4, COL25A1, COL9A2, COR8, CPEB3, CPNE9, CPO, CPS1, CPSF3, CPXM2, CRABP2, CREB5, CRTAM, CTD-3222D19.2, CTNNA3, CUL2, CYP2C45, CYP2J2L5, CYP2J6L2, DAB1, DAB2, DAPK3, DBX2, DCP1B, DCSTAMP, DCX, DDA1, DDC, DGKB, DGKI, DHRS11, DISP1, DIXDC1, DKK2, DLGAP2, DMP1, DMRTB1, DMTN, DNAH1, DNAJC6, DOCK2, DOLPP1, DPP9, DPYSL3, DRAXIN, DRD3, DTX2, DUSP10, DUSP3, DUSP5, EBF2, ECSCR, EEFSEC, EGLN3, EGR3, EIF4G1, ELAVL4, ELMOD1, EMCN, EMILIN3, ENTPD2L, ENTPD3, EOMES, EPB41L3, EPHA5, EPHA8, EPS15L1, ERC2, ERICH1, ERICH6B, EXOC3L4, FABP7, FADS6, FAM135B, FAM155B, FAM159A, FAM162B, FAM172A, FAM172BP, FAM184A, FAM185A, FAM210A, FAM46C, FAM64A, FAM65C, FAM71BL, FAM84A, FGB, FGF12, FGF18, FGF3, FGF5, FGG, FHDC1, FMN1, FOXC1, FOXI1, FOXP2, FSD2, FTO, GAB3, GABRA4, GABRA5, GABRG2, GAD2, GAL, GALNT9, GBX2, GCM2, GDAP1L1, GDAP2, GEMIN8, GFI1, GFRA3, GHSR, GLT1D1, GNAZ, GNPDA2, GPC2, GPHB5, GPR112, GPR12, GPR15, GPR35, GPR6, GPRC6A, GPRIN2, GRID1, GRID2, GRIK1, GRIN1, GRIN2A, GRM5, GRXCR1, GSTO1, GTF2IRD1, GTSF1, GUCA1B, GUCY2F, HAL, HAND2, HAP1, HEPHL1, HEXIM1, HGFAC, HMX2, HN1L, HNF4A, HNF4beta, HOXB8, HSD11B1b, HTR3A, HTR5A, HVCN1, ICOS, IFITM10, IGF2BP1, IGF2BP3, IL12B, IL17REL, IL1RAPL1, IMMT, IMPG2, INADL, INCENPL, INTS12, IRX3, IRX4, ITCH, ITIH2, JAM2, K123, KBTBD12, KCNAB1, KCNB1, KCNC2, KCNG4, KCNH1, KCNIP1, KCNIP2, KCNK10, KCNK18, KIAA1715, KIF26B, KIF2C, KIF3A, KIF3B, KIRREL3, KLF12, KLF7, KPNA2, KPNA7, KXD1, LACTBL1, LAMP3, LAMP5, LAMTOR1, LCT, LDB3, LGALS1, LGI1, LIG1, LIN28B, LIN7A, LLGL1, LMNA, LMOD2, LNX1, LOXHD1, LOXL4, LRIG3, LRIT1, LRRC7, LRRC8D, LRRN2, LRRTM4, LSM6, LUZP2, MAB21L2, MAL, MAML3, MAN2B1, MAP6, MAPK8, MAPRE2, MARCKSL1, MASP2, MATN1, MB, MBD4, MC4R, MCF2, MCF2L2, MCHR2, MCU, MED4, MED8, MEIOB, MEP1A, MEP1B, MFAP2, MFAP3L, MFSD2B, MLC1, MNT, MPO, MRPL53, MRPS22, MSANTD1, MYBL2, MYBPC3, MYBPH, MYF6, MYH13, MYL3, MYL4, MYO3A, MYO3B, MYOM1, MYOT, MYT1, MYT1L, N4BP2L2, NAF1, ND3, NDUFAF5, NDUFV3, NEB, NEDD4L, NEFH, NEFM, NETO2, NFATC2, NIPAL4, NKAP, NKX2-2, NKX6-2, NKX6-3, NOBOX, NOCT, NOG2, NOL4, NOL8, NOXRED1, NPC1, NPFF, NPR3, NPVF, NPY2R, NPY7R, NR1H4, NR2F2, NTNG1, NUDCD2, NUDT4, NUP62, NYAP2, OARD1, OCA2, OGFOD2, OLAH, OLIG3, ONECUT1, OPN1MSW, OPN3, OPN4, OPN4-1, OPNP, OPNVA, ORC5, OSBPL1A, OTUD7A, OTX1, OXR1, P2RX6, PABPC1L, PABPC4, PACSIN3, PADI1, PAK3, PAPOLG, PARP4, PARPBP, PAX3, PAX7, PCSK4, PDE11A, PDE6C, PDE6H, PDZRN4, PENK, PIK3AP1, PIPOX, PITPNM3, PKD2L1, PKD2L2, PKIB, PKM, PKN3, PLA2G15, PLAA, PLD5, PLEKHH2, PLK3, PLSCR5, PLXNA2, PNP, POP5, POU2AF1, POU4F2, POU4F3, POU6F2, PPCS, PPEF1, PPP2R2A, PPP6C, PRDM1, PRKAA2, PRKCA, PRKG2, PRLHR, PRMT3, PRRG3, PRRG4, PRSS55, PSMA5, PSMB3, PSTPIP2, PTCHD4, PTGES3, PTPRG, PTPRK, PTPRM, PTPRN2, PWWP2B, RAB23, RAB32, RAB6A, RAB7A, RAD9B, RASD2, RASL11A, RBFOX1, RBM44, RBM48, RBP2, RBP4B, RBPMS2, RCSD1, REPS1, RFX4, RHO, RHOF, RIMS1, RMDN2, RNF126, RNF146, RNF32, RNF6, RNF8, ROBO1, RP1-37E16.12, RP11-166N6.3, RP11-505K9.4, RP11-834C11.12, RP1L1, RP4-613B23.5, RPP25, RPP30, RSPO1, RYR2, SATB2, SCARB1, SCN3B, SCN5A, SCNN1B, SCTR, SDC3, SDF2, SEC11C, SEC14L1, SEMA3D, SEMA5A, SEPP1L, SERPINE3, SETD9, SF3A1, SFN, SFXN5, SGCZ, SGIP1, SGOL2, SH2B2, SH2D4B, SH3BGR, SH3GL2, SHC3, SHISA9, SIDT1, SIGLEC15, SIM1, SIN3A, SLC16A8, SLC18A2, SLC18A3, SLC24A1, SLC25A47, SLC2A5, SLC32A1, SLC43A3, SLC46A3, SLC4A1AP, SLC6A11, SLC6A13, SLC6A5, SLCO4A1, SLITRK5, SMARCA4, SMARCAD1, SMIM20, SMPDL3A, SNCA, SNCAIP, SNRNP35, SNRPD1, SNX1, SNX27, SOD3, SORCS3, SOX14, SPDL1, SPRY3, SPRY4, SPSB1, SRM, SRRM4, ST6GALNAC1, ST6GALNAC3, ST8SIA6, STK32B, STX18, STXBP5L, STYX, SUB1L1, SURF2, SUSD1, SUSD3, SV2B, SYN3, SYPL1, SYT15, SYT6, SYTL5, TANGO2, TAT, TBX15, TBX19, TBX20, TBX22, TBX5, TCEA2, TDRD9, TEAD3, TENM1, TFAP2A, TFAP2B, TFAP2C, THAP1, THL, THY1, TLX1, TMEM114, TMEM132D, TMEM163, TMEM178B, TMPRSS11D, TMPRSS15, TMPRSS3, TMPRSS7, TNFAIP8, TNFSF8, TNIP3, TNN, TNNC1, TOPAZ1, TP53I11, TP63, TPTE2, TRABD2B, TRDN, TRHDE, TRIM24, TRIM66, TRPC3, TRPM2, TSPAN7, TTC13, TWISTNB, TXN, TXNL1, TYRP1, UBALD2, UBE2F, UBFD1, UCHL3, UNCX, UROC1, USP22, VASN, VAV2, VSX1, VTG1, VTI1B, VWA1, WASF1, WASF3, WASH1, WEE2, WNT8A, ZBTB49, ZC2HC1C, ZCRB1, ZDHHC22, ZFP64, ZHX2, ZIC2, ZNF703, ZNF804A, ZP2, ZPAX, ZPBP2, ZPLD1, ZYX"
"brown","AARSD1, ABI3BP, ADAM23, ADGB, AGBL2, AK7, AK8, AKD1, AL928654.7, ALMS1, ANKEF1, ANKMY1, ANKRD10, ANKRD42, ANXA1, ANXA11, ANXA2, ANXA8, APLF, APOBEC4, ARHGAP18, ARHGEF1, ARHGEF33, ARL13B, ARL3, ARL6, ARMC2, ARMC3, ARMC4, ARMC9, ASB14, ASL2, ASS1, ATP2A1, AvBD5, AVP, AZIN2, B3GALT1, B3GNT4, B9D1, BAAT, BBS1, BBS10, BBS12, BBS4, BBS7, BPNT1, C10H15ORF26, C11H19ORF40, C11ORF16, C11ORF85, C11ORF88, C11ORF97, C14H16ORF52, C17H9ORF171, C17H9ORF9, C18ORF42, C1H11ORF70, C1H12ORF63, C1H21ORF59, C1H22ORF23, C1HXORF59, C20H20ORF85, C20ORF27, C20ORF96, C24H11ORF63, C2H7ORF63, C3H20ORF26, C3H2orf71, C3ORF48, C5ORF30, C6, C7H21ORF58, C8G, C8H1ORF173, C8H1orf228, CADM1, CALHM1, CALML4, CAMK2A, CAPN10, CAPN8, CAPN9, CAPSL, CASC1, CBY1, CCDC103, CCDC108, CCDC121, CCDC13, CCDC135, CCDC146, CCDC147, CCDC148, CCDC157, CCDC169, CCDC17, CCDC170, CCDC171, CCDC176, CCDC178, CCDC180, CCDC181, CCDC27, CCDC33, CCDC37, CCDC39, CCDC40, CCDC42B, CCDC66, CCDC67, CCDC78, CCDC83, CCDC88C, CCDC96, CCR6, CD164L2, CD24, CDC14A, CDH1, CDHR3, CDHR4, CDKL1, CDKL2, CECR1, CELF3, CEP104, CEP126, CEP164, CEP19, CEP57L1, CEP78, CERKL, CETN1, CETN3, CFAP126, CFAP20, CFAP221, CFAP43, CFAP44, CFAP45, CFAP57, CFAP99, CFTR, CHL1, CHRM3, CHST6, CHST9, CILD27, CLDN1, CNGA2, CNGA3, CNTRL, COQ2, CORO2A, CP, CPA5, CROCC, CSPP1, CYP2J2L6, CZH5ORF42, DAW1, DCDC2, DDX25, DDX43, DELE, DENND2D, DHX33, DIRC2, DNAAF2, DNAAF5, DNAH17, DNAH5, DNAH7, DNAH9, DNAI1, DNAI2, DNAJB13, DNAJC25, DNAL1, DNAL4, DPF1, DRC1, DSG4, DTHD1, DYNC2H1, DYNLRB2, DYRK3, DYSF, DYTN, DYX1C1, DZANK1, DZIP1, ECHDC2, EDARADD, EFCAB1, EFCAB2, EFCAB5, EFHC1, EFHC2, ELF3, ELOVL5, ENDOV, ENKUR, ENO2, ENO4, EPHA7, EPHX1L, EPM2A, FAIM, FAM107A, FAM118B, FAM124A, FAM13C, FAM149A, FAM154B, FAM179B, FAM183A, FAM194A, FAM210B, FAM221A, FAM228, FAM26F, FAM81A, FAM92A1, FBXL13, FBXO16, FER1L4, FGF7, FN3K, FN3KRP, FOLH1, FOLR1, FOXA1, FOXJ1, FRMPD2, FRZB, FSIP1, GABRP, GALC, GAS2L2, GAS8, GBGT1, GCH1, GIF, GNB1L, GNL2, GOLM1, GPR37, GPR61, GPR64, GPT2, GXYLT1, HBEGF, HECTD2, HEPH, HIPK1, HNF4G, HOXA3, HRH3, HSBP1L1, HYDIN, IFT122, IFT140, IFT27, IFT74, IFT80, IFT81, IFT88, IKBKE, IL13RA2, IL22RA1, IL7, INSM1, IQCA1, IQCD, IQCE, IQCHL, IQCK, IQUB, ITGB8, ITM2C, KATNAL1, KATNAL2, KBTBD10, KCNJ13, KCNK16, KCNK5, KCTD19, KIAA0556, KIAA0753, KIAA1107, KIAA1211L, KIAA1407, KIF27, KIF6, KIF9, KLF4, KMO, KRT10, LAD1, LCA5L, LDLRAD1, LEKR1, LMO7, LMX1B, LPAR3, LRGUK, LRRC10B, LRRC17, LRRC18, LRRC23, LRRC34, LRRC46, LRRC48, LRRC71, LRRIQ1, LY6E, LZTFL1, MAATS1, MAK, MAP1A, MAP3K19, MAPK15, MAT1A, MDM1, MDM2, MEIG1, MEOX1, MEST, MIIP, MITD1, MLF1, MN1, MORN3, MORN5, MRAP2, MRPL38, MRPS6, MSLN, MTCH2, MURC, MYO10L, MYO15L, MYO7A, MYOM3, NCAPG2, NCS1, NDOR1, NEBL, NEK10, NEK11, NEK4, NEK5, NEK8, NENF, NGEF, NHLRC4, NIM1K, NLK, NME5, NME7, NPFFR2, NPHP1, NPRL2, NPY, NRGN, NSUN7, NTN4L, OCM, ODF2, ODF2L, OIT3, OSBPL10, OSCP1, OTC, OVCH2, OXT, PACRG, PAH, PAX2, PCNT, PCNXL4, PCP4, PEX11G, PFN4, PHGDH, PHTF1, PI15, PIGQ, PIH1D2, PIH1D3, PLCD1, PLEKHG7, PLEKHS1, PNPLA3, PPCDC, PPIL6, PPP1R36, PPP1R3A, PPP1R42, PROKR2, PSTK, PTPDC1, PTPRF, RAB28, RAB36, RABL2B, RASGRP1, RBKS, RBM38, RCAN2, REL, RFK, RFX3, RGS12, RGS2, RGS22, RHPN1, RHPN2, RIBC2, RNH1, ROPN1L, RP1, RP11-166N6.1, RP11-447L10.1, RP11-514P8.6, RP11-690P14.4, RP11-724O16.1, RP11-77K12.7, RP2, RPGR, RPRM, RSPH1, RSPH10B, RSPH14, RSPH3, RSPH9, RUNDC3B, RXFP1, SAMD15, SCNM1L, SEMA6D, SENP8, SERINC4, SERPIND1, SERPINE2, SGMS1, SH2D1B, SH2D5, SH3BGRL2, SHC2, SLC15A1, SLC24A5, SLC25A43, SLC26A3, SLC39A12, SLC44A5, SLC45A4, SLC4A3, SLC5A5, SLC6A20, SLC9A3R1, SOX6, SOX7, SOX9, SPAG1, SPAG17, SPAG6, SPAG8, SPATA17, SPATA18, SPATA6, SPEF2, ST14, STAG3, STOM, STYXL1, SYCE3, SYNE3, SYT16, SYTL3, TALDO1, TBC1D32, TBX3, TBXAS1, TC2N, TCP10, TCTE1, TCTN2, TCTN3, TEKT1, TEKT2, TEKT3, TEKT4, TEX9, THBS4, TLDC2, TM4SF4, TMC1, TMEM135, TMEM138, TMEM139, TMEM200A, TMEM248, TMEM67, TMEM80, TMPRSS4, TNFAIP6, TNFRSF8, TNNI3K, TP73, TPGS1, TPPP3, TRAF3IP1, TRAF4, TRAF5, TRIM13, TRIM67, TSEN2, TSNAXIP1, TSPAN19, TTC12, TTC18, TTC25, TTC26, TTC29, TTC30A, TTC34, TTC6, TTF2, TTLL10, TTLL2, TTLL3, TTLL5, TTR, TUB, TXNRD1, UBASH3A, UBE2B, UBR3, UBXN11, UGT8, UNC119, UPK1B, USH2A, USP2, VIM, VMO1, VPS29L, VPS33B, VWA3A, VWA3B, WDPCP, WDR16, WDR17, WDR27, WDR35, WDR60, WDR63, WDR66, WDR78, WIPF3, ZBTB24, ZIC4, ZNF143, ZNF385D, ZSWIM7"
"greenyellow","ABRA, ADAMTS18, ASB9, ASIC5, ATOH7, ATP2C1, ATP6, CD3D, CKMT1A, CMTM8, CTSO, CYP2R1, CZH9ORF3, DLX5, DLX6, DNAH3, DSCR6, ERMN, FAM20C, GALR2, GATA2, HKDC1, HMGN5, HOXD11, HOXD12, IL20RA, IL20RB, KCNJ15, LECT1, LGALS2, LGR4, LGR5, MPPED1, MSX2, MYCN, OPRM1, PDS5B, PITX1, PLA2G12B, PLCB4, POU3F2, S100A13, SERPINB12, SLC10A4, SLC26A7, SLC27A6, SLC2A1, SLC2A3, SPINK5, SPOCK3, ST6GAL2, TEKT5, TMEM26, TMEM45B, TMPRSS2, TMSB4X, TSPAN8, VWC2, ZADH2"
"pink","AADAT, ACPP, ADRA2A, AFF3, AK5, ALDH18A1, ANK3, ARHGAP42, ATF3, ATF4, ATP13A4, ATP8B3, AVDL, BCL2L14, BPIFB2, C11H19ORF12, C11ORF34, C18H17ORF67, CBS, CLASP2, CLDN10, CYP7A1, DDIT3, DHRS7, DMBT1, ERBB3, ERICH5, EXPH5, FLRT1, FLVCR2, FRMPD4, FRRS1L, FUT4, GCNT7, GGT1, GJB1, GLUL, GNA14, GPR146, GRXCR2, HNMT, HOMER2, HOXB6, HOXD3, ICA1, IGSF5, IL19, ITGB6, KAT6A, KIAA1324, KIF12, KLF15, LACC1, LPIN1, MAPK13, MARVELD3, MECOM, METTL21C, MMP1, MRVLDC3, NDRG1, NT5C3A, NXPH1, NXPH3, OVALX, OVALY, OVST, PDCD4, PDE8B, PGR, PIGR, PLG, PM20D2, PPAPDC1A, PRLH, PRR15L, PTGER3, QSOX1, RASA4, RASEF, REEP3, RIPK3, SAT1, SCX, SERPINB6, SH3RF2, SHANK2, SLC13A2, SLC16A5, SLC17A9, SLC22A18, SLC2A12, SLC30A8, SLC39A8, SLC5A9, SMIM14, SNCG, SOX4, SPINK7, SQSTM1, STEAP3, SYNJ2, SYTL1, TARS, TF, TMC5, TMEM213, TMEM246, TMEM51, TMPRSS11F, TNFSF10, TP53I3, TSPAN1, TTPA, VSIG1, WEE1, WIF1, WNT11, XBP1, XDH"
"salmon","AANAT, AGTR1, AQP8, BTBD17, CCKBR, CDH7, CHRNA3, CHRNB4, CLDN11, COL23A1, CSDC2, CYP11A1, CYP17A1, DBH, DEPTOR, DHCR7, ELFN2, FAM196A, FDX1L, FGFBP3, FKBP1B, GATA5, GJD2, GPR22, GRID2IP, GRIK3, GRIN2C, HSD11B2L, HSD3B2, HTR1E, IL12A, LPPR1, MAS1, NDRG4, NR5A1, NRIP3, NRN1, RUNDC3A, SEZ6, SFRP5, SHISA8, SI, SLC26A9, SNAP25, SRL, SSTR1, ST8SIA3, STAR, STMN2, SYT9, TAGLN3, TLX2, TRH, VSTM2A"
"yellow","ACCN2, ACKR4, ADGRD1, ADPRHL, AFAP1, AGBL3, ALDH1A2, ALG14, AMHR2, ANGPT2, ANGPTL1, ANK1, ANK2, AQP9, ARHGAP28, ATOH8, B2M, B3GNTL2, BCHE, BCL2A1, BCMO1, BNC1, C12ORF57, C1H12ORF69, C1QTNF2, C1QTNF5, C1QTNF7, C1R, C1S, C24H11ORF1, C2ORF54, C4H4ORF50, CA5B, CABP1, CAPN13, CAPNS2, CAV1, CCDC141, CCDC183, CCDC64, CD1C, CD38, CD40LG, CD59, CD72AGL, CD74, CD81, CD8B, CD99, CDH6, CDK17, CHAD, CHRNB3, CLVS2, CNTN3, CNTN5, COL8A1, COLEC10, COR7A, CRB2, CRISPLD1, CUTA, CXCL12, CXCL14, CYBRD1, CYTL1, DNAJC12, EDN3, EEF1D, EFEMP1, EML6, EMP1, ENPP3, ENTPD1, EPHB1, EPYC, ERP27, ETV7, F2R, F3, FAM105A, FAM107B, FAM132A, FAM155A, FAM180B, FAM26E, FAM83B, FASLG, FBLN5, FGF1, FGL1, FHL1, FHL2, FLRT2, FN1, FRY, FSHR, FSTL3, GAS6, GDNF, GNG11, GPR141, GPR143, GPX3, GRIP2, GULP1, GYPC, H1F0, HAPLN2, HRASLS, HSD11B1a, HSPB2, HTR2B, IL1RL1, ISLR, ISLR2, ITIH5, KANK4, KAZALD1, KCNE2, KCNE4, KCNH6, KCNH7, KCNJ8, KCNMB1, KCNQ5, KCTD12, KCTD4, KIAA1210, KIFC3, KK34, KLHL4, KRT12, KRT14, KRT75L2, KRT75L4, LHX9, LIPI, LIPT1, LPCAT2, LPPR4, LRRC4C, LRRN4, LSMEM1, LTBP1, LYVE1, MAOA, MAOB, MAP3K7CL, MASP1, MDFIC, MDK, MFGE8, MISP, MOBKL2C, MOXD1, MSMP, MSRB1, MSRB3, MXRA8, MYOZ2, NEK3, NEXN, NINJ2, NPR2, NTF3, NUDT6, OPRK1, OSR1, OTOGL, PAMR1, PCGF5, PDLIM3, PDPN, PDZRN3, PERP1, PGRMC1, PIK3R6, PINX1, PKNOX1, PLA2G4F, PLAC9, PODN, PODXL, PON2, POSTN, PPIC, PRDM6, PRKAG3, PRSS23, PTGFR, PTPLAD2, PTPRO, PTPRQ, PTPRVP, PXDC1, QRFP, RAB40B, RARRES1, RFTN1, RGS11, RHBG, RHOBTB3, RIC3, RNF212, RNF223, ROR1, RP11-5A19.5, RP5-1028K7.3, RP5-966M1.6, RPL29, S100A14, S100A4, S100B, SAMD14, SAMD9L, SCGN, SCIN, SCN2B, SCRG1, SCUBE3, SDPR, SERPINB2, SERPINF1, SH3TC2, SLC1A2, SLC26A6, SLC27A2, SMIM18, SOGA3, SOSTDC1, SPHKAP, SPTBN5, SRPX, SSPN, STAC, STARD13, STMN3, STRA13, SVOP, TFEC, TFPI2, TGFB3, TGFBI, TGM4, TMED11, TMEM220, TMEM255B, TMEM71, TMOD4, TSC22D3, VLDLR, VSTM5, WLS, WNT16, XKR4, ZC3HAV1L, ZNF609, ZNF804B"
